{"audit_file":{"object_key":"skempi-readiness-72bc80dd1524f7815039160bc095045308f4d56c9e819a84203a6fe70e508ec6/processing-audit.json","sha256":"78a9d127ba2e065da358f0fb1e5c7722da8729f7245b2890c098c3c35a8517bc","size_bytes":753},"git_commit":"00c5791db99cd46d0387db82dd3bfd7a1f526e24","grouping_unit":"publisher_link_and_shared_protein_component","held_out_partitions":[],"known_limitations":["Readiness only; no formal held-out allocation or scientific result.","Grouping uses names and publisher links; sequence homology was not independently audited.","Publisher mapping and wild-type identity checked; no structural features or repair."],"leakage_controls":["whole_components_only","groups_built_before_label_filtering"],"membership_file":{"object_key":"skempi-readiness-72bc80dd1524f7815039160bc095045308f4d56c9e819a84203a6fe70e508ec6/membership.csv","sha256":"dec049e2b5027593ed674d236211e4b571265105cb66e85f6405707a64e8c5e3","size_bytes":644091},"partitions":["external-candidate"],"processing_manifest_sha256":"4a9f491fa71b3630466de094e19f5e7b51765ff75e7ed10a345eee6cbcb2efdd","protocol_version":"m5d-skempi-readiness-v1","schema_version":"1","split_config_sha256":"025ca8555a63e1422f7a5a690ff46804eee6fbeb98eb9bbafd04525fb6939540","split_id":"skempi-readiness-72bc80dd1524f7815039160bc095045308f4d56c9e819a84203a6fe70e508ec6-groups"}
